<?xml version="1.1" encoding="UTF-8"?>
<!DOCTYPE assets SYSTEM "./dtd/asset-directory.dtd">
<assets>
    <asset>
        <type>directory</type>
        <name>Image Assets Directory</name>
        <path>./images/directory.xml</path>
    </asset>
    <asset>
        <type>directory</type>
        <name>UI Assets Directory</name>
        <path>./ui/directory.xml</path>
    </asset>
    <asset>
        <type>directory</type>
        <name>Video Assets Directory</name>
        <path>./videos/directory.xml</path>
    </asset>
    <asset>
        <type>directory</type>
        <name>Audio Assets Directory</name>
        <path>./audios/directory.xml</path>
    </asset>
    <asset>
        <type>directory</type>
        <name>Definitions Directory</name>
        <path>./maps/directory.xml</path>
    </asset>
</assets>